{"$schema":"https://json-schema.org/draft/2020-12/schema","$id":"https://mindclade.dev/schemas/training-phase-graph/v1","title":"TrainingPhaseGraph","type":"object","additionalProperties":false,"required":["schema_version","kind","metadata","spec","lineage","integrity"],"properties":{"schema_version":{"const":"mindclade.training-phase-graph/v1"},"kind":{"const":"TrainingPhaseGraph"},"metadata":{"$ref":"#/$defs/metadata"},"spec":{"type":"object","additionalProperties":false,"required":["phases","edges","execution_order","acyclic","max_transitions"],"properties":{"phases":{"type":"array","minItems":1,"maxItems":64,"items":{"type":"object","additionalProperties":false,"required":["phase_id","max_steps","checkpoint_interval"],"properties":{"phase_id":{"type":"string","pattern":"^[a-z][a-z0-9_-]{0,63}$"},"max_steps":{"type":"integer","minimum":1,"maximum":1000000000},"checkpoint_interval":{"type":"integer","minimum":1,"maximum":1000000000}}}},"edges":{"type":"array","maxItems":256,"items":{"type":"object","additionalProperties":false,"required":["from","to"],"properties":{"from":{"type":"string","minLength":1,"maxLength":64},"to":{"type":"string","minLength":1,"maxLength":64}}}},"execution_order":{"type":"array","minItems":1,"maxItems":64,"uniqueItems":true,"items":{"type":"string","minLength":1,"maxLength":64}},"acyclic":{"const":true},"max_transitions":{"type":"integer","minimum":1,"maximum":256}}},"lineage":{"type":"array","maxItems":32,"items":{"$ref":"#/$defs/artifact_ref"}},"integrity":{"$ref":"#/$defs/integrity"}},"$defs":{"digest":{"type":"string","pattern":"^sha256:[a-f0-9]{64}$"},"metadata":{"type":"object","additionalProperties":false,"required":["uid","created_at","producer","classification"],"properties":{"uid":{"type":"string","minLength":1,"maxLength":128},"created_at":{"type":"string","format":"date-time"},"producer":{"type":"string","minLength":1,"maxLength":128},"classification":{"enum":["PUBLIC","INTERNAL","RESTRICTED"]}}},"artifact_ref":{"type":"object","additionalProperties":false,"required":["uri","digest","media_type","schema_version"],"properties":{"uri":{"type":"string","pattern":"^artifacts/[A-Za-z0-9._~/-]+$"},"digest":{"$ref":"#/$defs/digest"},"media_type":{"type":"string","minLength":1,"maxLength":128},"schema_version":{"type":"string","minLength":1,"maxLength":128}}},"integrity":{"type":"object","additionalProperties":false,"required":["payload_digest"],"properties":{"payload_digest":{"$ref":"#/$defs/digest"},"evidence":{"type":"array","maxItems":32,"items":{"$ref":"#/$defs/artifact_ref"}}}}}}
