{"schema_version":"mindclade.training-phase-graph/v1","kind":"TrainingPhaseGraph","metadata":{"uid":"phase-graph-001","created_at":"2026-08-31T12:00:00Z","producer":"training-platform","classification":"INTERNAL"},"spec":{"phases":[{"phase_id":"warmup","max_steps":100,"checkpoint_interval":50},{"phase_id":"train","max_steps":1000,"checkpoint_interval":100}],"edges":[{"from":"warmup","to":"train"}],"execution_order":["warmup","train"],"acyclic":true,"max_transitions":2},"lineage":[],"integrity":{"payload_digest":"sha256:aaaaaaaaaaaaaaaaaaaaaaaaaaaaaaaaaaaaaaaaaaaaaaaaaaaaaaaaaaaaaaaa","evidence":[]}}
